{
  "schema_version": "1.0.0",
  "dataset": "frontline_snapshots",
  "generated_at": "2026-10-16T09:52:38.746Z",
  "coverage_start": "2022-02-23",
  "coverage_end": "2026-10-14",
  "record_count": 314,
  "sources": [
    {
      "name": "DeepStateMap public history",
      "url": "https://deepstatemap.live/",
      "role": "Geographic control snapshots filtered and mirrored by this project"
    }
  ],
  "methodology": "The 2022-02-23 baseline contains only the pre-full-scale-invasion occupation footprint. Later records point to dated DeepStateMap-derived snapshots. The latest stable alias is copied at generation time.",
  "license_notice": "No blanket license is granted for this collection. Each upstream source retains its own rights and terms. Review the source-specific terms and preserve attribution before reuse.",
  "snapshots": [
    {
      "date": "2022-02-23",
      "phase": "pre_invasion_baseline",
      "occupied_km2": 43744,
      "url": "/data/v1/frontline/baseline.geojson"
    },
    {
      "date": "2022-02-24",
      "phase": "full_scale_war",
      "url": "/data/v1/frontline/history/deepstatemap_20220224.geojson"
    },
    {
      "date": "2022-03-07",
      "phase": "full_scale_war",
      "url": "/data/v1/frontline/history/deepstatemap_20220307.geojson"
    },
    {
      "date": "2022-03-20",
      "phase": "full_scale_war",
      "url": "/data/v1/frontline/history/deepstatemap_20220320.geojson"
    },
    {
      "date": "2022-04-03",
      "phase": "full_scale_war",
      "url": "/data/v1/frontline/history/deepstatemap_20220403.geojson"
    },
    {
      "date": "2022-04-10",
      "phase": "full_scale_war",
      "url": "/data/v1/frontline/history/deepstatemap_20220410.geojson"
    },
    {
      "date": "2022-04-15",
      "phase": "full_scale_war",
      "url": "/data/v1/frontline/history/deepstatemap_20220415.geojson"
    },
    {
      "date": "2022-04-17",
      "phase": "full_scale_war",
      "url": "/data/v1/frontline/history/deepstatemap_20220417.geojson"
    },
    {
      "date": "2022-04-24",
      "phase": "full_scale_war",
      "url": "/data/v1/frontline/history/deepstatemap_20220424.geojson"
    },
    {
      "date": "2022-05-01",
      "phase": "full_scale_war",
      "url": "/data/v1/frontline/history/deepstatemap_20220501.geojson"
    },
    {
      "date": "2022-05-08",
      "phase": "full_scale_war",
      "url": "/data/v1/frontline/history/deepstatemap_20220508.geojson"
    },
    {
      "date": "2022-05-13",
      "phase": "full_scale_war",
      "url": "/data/v1/frontline/history/deepstatemap_20220513.geojson"
    },
    {
      "date": "2022-05-15",
      "phase": "full_scale_war",
      "url": "/data/v1/frontline/history/deepstatemap_20220515.geojson"
    },
    {
      "date": "2022-05-22",
      "phase": "full_scale_war",
      "url": "/data/v1/frontline/history/deepstatemap_20220522.geojson"
    },
    {
      "date": "2022-05-29",
      "phase": "full_scale_war",
      "url": "/data/v1/frontline/history/deepstatemap_20220529.geojson"
    },
    {
      "date": "2022-06-01",
      "phase": "full_scale_war",
      "url": "/data/v1/frontline/history/deepstatemap_20220601.geojson"
    },
    {
      "date": "2022-06-05",
      "phase": "full_scale_war",
      "url": "/data/v1/frontline/history/deepstatemap_20220605.geojson"
    },
    {
      "date": "2022-06-12",
      "phase": "full_scale_war",
      "url": "/data/v1/frontline/history/deepstatemap_20220612.geojson"
    },
    {
      "date": "2022-06-15",
      "phase": "full_scale_war",
      "url": "/data/v1/frontline/history/deepstatemap_20220615.geojson"
    },
    {
      "date": "2022-06-19",
      "phase": "full_scale_war",
      "url": "/data/v1/frontline/history/deepstatemap_20220619.geojson"
    },
    {
      "date": "2022-06-26",
      "phase": "full_scale_war",
      "url": "/data/v1/frontline/history/deepstatemap_20220626.geojson"
    },
    {
      "date": "2022-07-03",
      "phase": "full_scale_war",
      "url": "/data/v1/frontline/history/deepstatemap_20220703.geojson"
    },
    {
      "date": "2022-07-10",
      "phase": "full_scale_war",
      "url": "/data/v1/frontline/history/deepstatemap_20220710.geojson"
    },
    {
      "date": "2022-07-15",
      "phase": "full_scale_war",
      "url": "/data/v1/frontline/history/deepstatemap_20220715.geojson"
    },
    {
      "date": "2022-07-16",
      "phase": "full_scale_war",
      "url": "/data/v1/frontline/history/deepstatemap_20220716.geojson"
    },
    {
      "date": "2022-07-23",
      "phase": "full_scale_war",
      "url": "/data/v1/frontline/history/deepstatemap_20220723.geojson"
    },
    {
      "date": "2022-07-30",
      "phase": "full_scale_war",
      "url": "/data/v1/frontline/history/deepstatemap_20220730.geojson"
    },
    {
      "date": "2022-08-06",
      "phase": "full_scale_war",
      "url": "/data/v1/frontline/history/deepstatemap_20220806.geojson"
    },
    {
      "date": "2022-08-13",
      "phase": "full_scale_war",
      "url": "/data/v1/frontline/history/deepstatemap_20220813.geojson"
    },
    {
      "date": "2022-08-20",
      "phase": "full_scale_war",
      "url": "/data/v1/frontline/history/deepstatemap_20220820.geojson"
    },
    {
      "date": "2022-08-27",
      "phase": "full_scale_war",
      "url": "/data/v1/frontline/history/deepstatemap_20220827.geojson"
    },
    {
      "date": "2022-08-29",
      "phase": "full_scale_war",
      "url": "/data/v1/frontline/history/deepstatemap_20220829.geojson"
    },
    {
      "date": "2022-09-03",
      "phase": "full_scale_war",
      "url": "/data/v1/frontline/history/deepstatemap_20220903.geojson"
    },
    {
      "date": "2022-09-10",
      "phase": "full_scale_war",
      "url": "/data/v1/frontline/history/deepstatemap_20220910.geojson"
    },
    {
      "date": "2022-09-11",
      "phase": "full_scale_war",
      "url": "/data/v1/frontline/history/deepstatemap_20220911.geojson"
    },
    {
      "date": "2022-09-17",
      "phase": "full_scale_war",
      "url": "/data/v1/frontline/history/deepstatemap_20220917.geojson"
    },
    {
      "date": "2022-09-24",
      "phase": "full_scale_war",
      "url": "/data/v1/frontline/history/deepstatemap_20220924.geojson"
    },
    {
      "date": "2022-10-01",
      "phase": "full_scale_war",
      "url": "/data/v1/frontline/history/deepstatemap_20221001.geojson"
    },
    {
      "date": "2022-10-08",
      "phase": "full_scale_war",
      "url": "/data/v1/frontline/history/deepstatemap_20221008.geojson"
    },
    {
      "date": "2022-10-15",
      "phase": "full_scale_war",
      "url": "/data/v1/frontline/history/deepstatemap_20221015.geojson"
    },
    {
      "date": "2022-10-22",
      "phase": "full_scale_war",
      "url": "/data/v1/frontline/history/deepstatemap_20221022.geojson"
    },
    {
      "date": "2022-10-29",
      "phase": "full_scale_war",
      "url": "/data/v1/frontline/history/deepstatemap_20221029.geojson"
    },
    {
      "date": "2022-11-05",
      "phase": "full_scale_war",
      "url": "/data/v1/frontline/history/deepstatemap_20221105.geojson"
    },
    {
      "date": "2022-11-11",
      "phase": "full_scale_war",
      "url": "/data/v1/frontline/history/deepstatemap_20221111.geojson"
    },
    {
      "date": "2022-11-12",
      "phase": "full_scale_war",
      "url": "/data/v1/frontline/history/deepstatemap_20221112.geojson"
    },
    {
      "date": "2022-11-19",
      "phase": "full_scale_war",
      "url": "/data/v1/frontline/history/deepstatemap_20221119.geojson"
    },
    {
      "date": "2022-11-26",
      "phase": "full_scale_war",
      "url": "/data/v1/frontline/history/deepstatemap_20221126.geojson"
    },
    {
      "date": "2022-12-03",
      "phase": "full_scale_war",
      "url": "/data/v1/frontline/history/deepstatemap_20221203.geojson"
    },
    {
      "date": "2022-12-10",
      "phase": "full_scale_war",
      "url": "/data/v1/frontline/history/deepstatemap_20221210.geojson"
    },
    {
      "date": "2022-12-15",
      "phase": "full_scale_war",
      "url": "/data/v1/frontline/history/deepstatemap_20221215.geojson"
    },
    {
      "date": "2022-12-17",
      "phase": "full_scale_war",
      "url": "/data/v1/frontline/history/deepstatemap_20221217.geojson"
    },
    {
      "date": "2022-12-24",
      "phase": "full_scale_war",
      "url": "/data/v1/frontline/history/deepstatemap_20221224.geojson"
    },
    {
      "date": "2022-12-31",
      "phase": "full_scale_war",
      "url": "/data/v1/frontline/history/deepstatemap_20221231.geojson"
    },
    {
      "date": "2023-01-01",
      "phase": "full_scale_war",
      "url": "/data/v1/frontline/history/deepstatemap_20230101.geojson"
    },
    {
      "date": "2023-01-07",
      "phase": "full_scale_war",
      "url": "/data/v1/frontline/history/deepstatemap_20230107.geojson"
    },
    {
      "date": "2023-01-13",
      "phase": "full_scale_war",
      "url": "/data/v1/frontline/history/deepstatemap_20230113.geojson"
    },
    {
      "date": "2023-01-20",
      "phase": "full_scale_war",
      "url": "/data/v1/frontline/history/deepstatemap_20230120.geojson"
    },
    {
      "date": "2023-01-27",
      "phase": "full_scale_war",
      "url": "/data/v1/frontline/history/deepstatemap_20230127.geojson"
    },
    {
      "date": "2023-02-03",
      "phase": "full_scale_war",
      "url": "/data/v1/frontline/history/deepstatemap_20230203.geojson"
    },
    {
      "date": "2023-02-10",
      "phase": "full_scale_war",
      "url": "/data/v1/frontline/history/deepstatemap_20230210.geojson"
    },
    {
      "date": "2023-02-15",
      "phase": "full_scale_war",
      "url": "/data/v1/frontline/history/deepstatemap_20230215.geojson"
    },
    {
      "date": "2023-02-16",
      "phase": "full_scale_war",
      "url": "/data/v1/frontline/history/deepstatemap_20230216.geojson"
    },
    {
      "date": "2023-02-23",
      "phase": "full_scale_war",